[
  {
    "id": 1,
    "base_currency": "EUR",
    "quote_currency": "CHF",
    "rate_date": "2024-04-22",
    "rate": 0.96
  },
  {
    "id": 2,
    "base_currency": "EUR",
    "quote_currency": "GBP",
    "rate_date": "2024-04-22",
    "rate": 0.85
  },
  {
    "id": 3,
    "base_currency": "EUR",
    "quote_currency": "JPY",
    "rate_date": "2024-04-22",
    "rate": 162.05
  },
  {
    "id": 4,
    "base_currency": "EUR",
    "quote_currency": "MXN",
    "rate_date": "2024-04-22",
    "rate": 18.63
  },
  {
    "id": 5,
    "base_currency": "EUR",
    "quote_currency": "USD",
    "rate_date": "2024-04-22",
    "rate": 1.09
  },
  {
    "id": 6,
    "base_currency": "EUR",
    "quote_currency": "CHF",
    "rate_date": "2024-04-23",
    "rate": 0.96
  },
  {
    "id": 7,
    "base_currency": "EUR",
    "quote_currency": "GBP",
    "rate_date": "2024-04-23",
    "rate": 0.86
  },
  {
    "id": 8,
    "base_currency": "EUR",
    "quote_currency": "JPY",
    "rate_date": "2024-04-23",
    "rate": 162.62
  },
  {
    "id": 9,
    "base_currency": "EUR",
    "quote_currency": "MXN",
    "rate_date": "2024-04-23",
    "rate": 18.62
  },
  {
    "id": 10,
    "base_currency": "EUR",
    "quote_currency": "USD",
    "rate_date": "2024-04-23",
    "rate": 1.09
  },
  {
    "id": 11,
    "base_currency": "EUR",
    "quote_currency": "CHF",
    "rate_date": "2024-04-24",
    "rate": 0.95
  },
  {
    "id": 12,
    "base_currency": "EUR",
    "quote_currency": "GBP",
    "rate_date": "2024-04-24",
    "rate": 0.85
  },
  {
    "id": 13,
    "base_currency": "EUR",
    "quote_currency": "JPY",
    "rate_date": "2024-04-24",
    "rate": 162.77
  },
  {
    "id": 14,
    "base_currency": "EUR",
    "quote_currency": "MXN",
    "rate_date": "2024-04-24",
    "rate": 18.63
  },
  {
    "id": 15,
    "base_currency": "EUR",
    "quote_currency": "USD",
    "rate_date": "2024-04-24",
    "rate": 1.08
  },
  {
    "id": 16,
    "base_currency": "EUR",
    "quote_currency": "CHF",
    "rate_date": "2024-04-25",
    "rate": 0.95
  },
  {
    "id": 17,
    "base_currency": "EUR",
    "quote_currency": "GBP",
    "rate_date": "2024-04-25",
    "rate": 0.85
  },
  {
    "id": 18,
    "base_currency": "EUR",
    "quote_currency": "JPY",
    "rate_date": "2024-04-25",
    "rate": 162.93
  },
  {
    "id": 19,
    "base_currency": "EUR",
    "quote_currency": "MXN",
    "rate_date": "2024-04-25",
    "rate": 18.71
  },
  {
    "id": 20,
    "base_currency": "EUR",
    "quote_currency": "USD",
    "rate_date": "2024-04-25",
    "rate": 1.08
  },
  {
    "id": 21,
    "base_currency": "EUR",
    "quote_currency": "CHF",
    "rate_date": "2024-04-26",
    "rate": 0.95
  },
  {
    "id": 22,
    "base_currency": "EUR",
    "quote_currency": "GBP",
    "rate_date": "2024-04-26",
    "rate": 0.85
  },
  {
    "id": 23,
    "base_currency": "EUR",
    "quote_currency": "JPY",
    "rate_date": "2024-04-26",
    "rate": 162.15
  },
  {
    "id": 24,
    "base_currency": "EUR",
    "quote_currency": "MXN",
    "rate_date": "2024-04-26",
    "rate": 18.84
  },
  {
    "id": 25,
    "base_currency": "EUR",
    "quote_currency": "USD",
    "rate_date": "2024-04-26",
    "rate": 1.08
  },
  {
    "id": 26,
    "base_currency": "EUR",
    "quote_currency": "CHF",
    "rate_date": "2024-04-29",
    "rate": 0.95
  },
  {
    "id": 27,
    "base_currency": "EUR",
    "quote_currency": "GBP",
    "rate_date": "2024-04-29",
    "rate": 0.84
  },
  {
    "id": 28,
    "base_currency": "EUR",
    "quote_currency": "JPY",
    "rate_date": "2024-04-29",
    "rate": 161.66
  },
  {
    "id": 29,
    "base_currency": "EUR",
    "quote_currency": "MXN",
    "rate_date": "2024-04-29",
    "rate": 18.87
  },
  {
    "id": 30,
    "base_currency": "EUR",
    "quote_currency": "USD",
    "rate_date": "2024-04-29",
    "rate": 1.08
  },
  {
    "id": 31,
    "base_currency": "EUR",
    "quote_currency": "CHF",
    "rate_date": "2024-04-30",
    "rate": 0.95
  },
  {
    "id": 32,
    "base_currency": "EUR",
    "quote_currency": "GBP",
    "rate_date": "2024-04-30",
    "rate": 0.84
  },
  {
    "id": 33,
    "base_currency": "EUR",
    "quote_currency": "JPY",
    "rate_date": "2024-04-30",
    "rate": 162.27
  },
  {
    "id": 34,
    "base_currency": "EUR",
    "quote_currency": "MXN",
    "rate_date": "2024-04-30",
    "rate": 18.81
  },
  {
    "id": 35,
    "base_currency": "EUR",
    "quote_currency": "USD",
    "rate_date": "2024-04-30",
    "rate": 1.07
  },
  {
    "id": 36,
    "base_currency": "EUR",
    "quote_currency": "CHF",
    "rate_date": "2024-05-01",
    "rate": 0.95
  },
  {
    "id": 37,
    "base_currency": "EUR",
    "quote_currency": "GBP",
    "rate_date": "2024-05-01",
    "rate": 0.84
  },
  {
    "id": 38,
    "base_currency": "EUR",
    "quote_currency": "JPY",
    "rate_date": "2024-05-01",
    "rate": 161.97
  },
  {
    "id": 39,
    "base_currency": "EUR",
    "quote_currency": "MXN",
    "rate_date": "2024-05-01",
    "rate": 18.63
  },
  {
    "id": 40,
    "base_currency": "EUR",
    "quote_currency": "USD",
    "rate_date": "2024-05-01",
    "rate": 1.07
  },
  {
    "id": 41,
    "base_currency": "EUR",
    "quote_currency": "CHF",
    "rate_date": "2024-05-02",
    "rate": 0.95
  },
  {
    "id": 42,
    "base_currency": "EUR",
    "quote_currency": "GBP",
    "rate_date": "2024-05-02",
    "rate": 0.83
  },
  {
    "id": 43,
    "base_currency": "EUR",
    "quote_currency": "JPY",
    "rate_date": "2024-05-02",
    "rate": 161.52
  },
  {
    "id": 44,
    "base_currency": "EUR",
    "quote_currency": "MXN",
    "rate_date": "2024-05-02",
    "rate": 18.62
  },
  {
    "id": 45,
    "base_currency": "EUR",
    "quote_currency": "USD",
    "rate_date": "2024-05-02",
    "rate": 1.08
  },
  {
    "id": 46,
    "base_currency": "EUR",
    "quote_currency": "CHF",
    "rate_date": "2024-05-03",
    "rate": 0.94
  },
  {
    "id": 47,
    "base_currency": "EUR",
    "quote_currency": "GBP",
    "rate_date": "2024-05-03",
    "rate": 0.83
  },
  {
    "id": 48,
    "base_currency": "EUR",
    "quote_currency": "JPY",
    "rate_date": "2024-05-03",
    "rate": 161.14
  },
  {
    "id": 49,
    "base_currency": "EUR",
    "quote_currency": "MXN",
    "rate_date": "2024-05-03",
    "rate": 18.63
  },
  {
    "id": 50,
    "base_currency": "EUR",
    "quote_currency": "USD",
    "rate_date": "2024-05-03",
    "rate": 1.08
  },
  {
    "id": 51,
    "base_currency": "EUR",
    "quote_currency": "CHF",
    "rate_date": "2024-05-06",
    "rate": 0.94
  },
  {
    "id": 52,
    "base_currency": "EUR",
    "quote_currency": "GBP",
    "rate_date": "2024-05-06",
    "rate": 0.82
  },
  {
    "id": 53,
    "base_currency": "EUR",
    "quote_currency": "JPY",
    "rate_date": "2024-05-06",
    "rate": 161.59
  },
  {
    "id": 54,
    "base_currency": "EUR",
    "quote_currency": "MXN",
    "rate_date": "2024-05-06",
    "rate": 18.61
  },
  {
    "id": 55,
    "base_currency": "EUR",
    "quote_currency": "USD",
    "rate_date": "2024-05-06",
    "rate": 1.09
  },
  {
    "id": 56,
    "base_currency": "EUR",
    "quote_currency": "CHF",
    "rate_date": "2024-05-07",
    "rate": 0.94
  },
  {
    "id": 57,
    "base_currency": "EUR",
    "quote_currency": "GBP",
    "rate_date": "2024-05-07",
    "rate": 0.82
  },
  {
    "id": 58,
    "base_currency": "EUR",
    "quote_currency": "JPY",
    "rate_date": "2024-05-07",
    "rate": 162.35
  },
  {
    "id": 59,
    "base_currency": "EUR",
    "quote_currency": "MXN",
    "rate_date": "2024-05-07",
    "rate": 18.64
  },
  {
    "id": 60,
    "base_currency": "EUR",
    "quote_currency": "USD",
    "rate_date": "2024-05-07",
    "rate": 1.08
  },
  {
    "id": 61,
    "base_currency": "EUR",
    "quote_currency": "CHF",
    "rate_date": "2024-05-08",
    "rate": 0.93
  },
  {
    "id": 62,
    "base_currency": "EUR",
    "quote_currency": "GBP",
    "rate_date": "2024-05-08",
    "rate": 0.82
  },
  {
    "id": 63,
    "base_currency": "EUR",
    "quote_currency": "JPY",
    "rate_date": "2024-05-08",
    "rate": 161.51
  },
  {
    "id": 64,
    "base_currency": "EUR",
    "quote_currency": "MXN",
    "rate_date": "2024-05-08",
    "rate": 18.67
  },
  {
    "id": 65,
    "base_currency": "EUR",
    "quote_currency": "USD",
    "rate_date": "2024-05-08",
    "rate": 1.09
  },
  {
    "id": 66,
    "base_currency": "EUR",
    "quote_currency": "CHF",
    "rate_date": "2024-05-09",
    "rate": 0.93
  },
  {
    "id": 67,
    "base_currency": "EUR",
    "quote_currency": "GBP",
    "rate_date": "2024-05-09",
    "rate": 0.82
  },
  {
    "id": 68,
    "base_currency": "EUR",
    "quote_currency": "JPY",
    "rate_date": "2024-05-09",
    "rate": 161.18
  },
  {
    "id": 69,
    "base_currency": "EUR",
    "quote_currency": "MXN",
    "rate_date": "2024-05-09",
    "rate": 18.72
  },
  {
    "id": 70,
    "base_currency": "EUR",
    "quote_currency": "USD",
    "rate_date": "2024-05-09",
    "rate": 1.09
  },
  {
    "id": 71,
    "base_currency": "EUR",
    "quote_currency": "CHF",
    "rate_date": "2024-05-10",
    "rate": 0.93
  },
  {
    "id": 72,
    "base_currency": "EUR",
    "quote_currency": "GBP",
    "rate_date": "2024-05-10",
    "rate": 0.82
  },
  {
    "id": 73,
    "base_currency": "EUR",
    "quote_currency": "JPY",
    "rate_date": "2024-05-10",
    "rate": 161.41
  },
  {
    "id": 74,
    "base_currency": "EUR",
    "quote_currency": "MXN",
    "rate_date": "2024-05-10",
    "rate": 18.66
  },
  {
    "id": 75,
    "base_currency": "EUR",
    "quote_currency": "USD",
    "rate_date": "2024-05-10",
    "rate": 1.09
  },
  {
    "id": 76,
    "base_currency": "EUR",
    "quote_currency": "CHF",
    "rate_date": "2024-05-13",
    "rate": 0.93
  },
  {
    "id": 77,
    "base_currency": "EUR",
    "quote_currency": "GBP",
    "rate_date": "2024-05-13",
    "rate": 0.82
  },
  {
    "id": 78,
    "base_currency": "EUR",
    "quote_currency": "JPY",
    "rate_date": "2024-05-13",